{
  "deletions": [],
  "files": [
    {
      "sha256": "TBD",
      "source": "package/01_files/docs/ai_contract.md",
      "target": "docs/hydration_sentinel/ai_contract.md"
    }
  ],
  "mode": "additive-first",
  "module_id": "hydration_sentinel_ai_debugging_assistant",
  "module_name": "Hydration Sentinel AI Debugging Assistant",
  "module_version": "1.0.0",
  "notes": [
    "offline-first",
    "smoke-first"
  ],
  "schema_version": "1.0.0",
  "target_repo": "hitech-os"
}